"版本","條次","變更類型","變更方向","對甲方法律/商業風險","說明"
"v5","6.4","新增","對甲方有利","中","甲方可要求停止、延後或調整維護/變更，乙方不得拒絕，加強甲方對變更時機的控制"
"v5","7.6","新增","對甲方有利","低–中","甲方得要求更換服務人員，乙方需於 3 個工作日內完成，增加甲方對服務團隊的人員控制"
"v5","12.2","新增/修改","對甲方有利","高","甲方可於任何時間以 15 日通知無條件終止協議，強化單方解約權"
"v5","12.3","新增","對甲方有利","中","若甲方認為服務品質或風險控管未達期待，可要求限期改善，未改善可立即終止"
"v5","12.4","新增","對甲方有利","高","乙方不得逕行提前終止協議，除非經甲方書面同意，大幅限制乙方解約自由"
"v5","12.5","新增","對甲方有利","高","終止或屆滿時，乙方需於 5 日內完成交接與資料返還，不得主張留置或延遲，確保移轉與資料控制"
"v5","6.3 / 12.6","保留/強化","對甲方有利","中","終止後資料返還與刪除義務維持，搭配更強的交接時程，減少鎖死風險"